Comment,Sentiment ScoreWhat's a good camera that can send the video to your phone. So you can edit on your phone.,0.4404
Can this output 1080p for say livestream or connect to OBS?,0.0
"Very clear and helpful, thank you!",0.8293
leaning towards this camera for my new (first) main camera. Moving from a go pro hero 5.. so a new world to learn,0.5574
In video can I set my shutter speed and apature manually and have ISO set to Auto. PS most reviews say the M5 video quality is not very good quality but I've not come across any reviews that say the same about the SL2/200D video.,-0.2051
....no 4k just makes it really tough to go with a budget canon when you can get 4k in comparable cameras....come on Canon....get on the 4k bandwagon,-0.2006
"Hi there! Awesome video. Watching this convinced me to go ahead and purchase the SL2. However I have a question - I was planning on using this to record 1-hour interviews. This is my first DSLR so I'm learning a lot as a go. I've been looking some things up and it seems there's some sort of limitation on video length. Is this really true? If so, is it recommended I use a camcorder instead for a 1-hour interview? Thanks!",0.9291
$499-Digix 7 = Gr8 value. I have a 70D and this is a great camera. No reason to spend $200 more on 7ti,0.8402
"i have been saving up for this camera for months! one of my friends has one and i help her film for her projects and it's one of the most easiest and greatest cameras to work with. and i love filming and editing, especially if it's easy.",0.9683
"Thanks for taking the time to do what you do!! You have helped me decide on buying the SL2, I am a licensed Minister and I write inspirational messages and plan on vlogging so you have definitely steered me in the right direction. God Bless You Man!! Happy New Year!!!",0.958
Hey Sean... was in a fix trying to figure out which camera would be best for my upcoming Youtube channel and the content i plan on creating and i have to say you are a life saver. NEW subscriber!!!! thank you...,0.877
"This video helped me decide what to get, (was looking at Nikon 7100) Thank You... BB23",0.3612
Can this camera be good for wedding videos?,0.4404
What about the Panasonic FZ 82 is it worth it? Just for the 4K and 1200mm lens?,0.3094
Very good Review !,0.54
"I have a YouTube channel this is my dream camera, but I just don’t  have the money! 😭",0.2003
is that a JOBY Gorilla pod Hybrid or Zoom?? thanks,0.504
Which one is the best camera for photography 200d or 700d or 750D or 800D and is 200d good enough to be compare with 80d in picture quality?,0.7964
"Sean!  Nikki got me the SL2 for Christmas and she mentioned your video was super helpful.  Can't wait to step up that Big Kids game!

- Neil",0.8065
Can you use a dummy battery and if so pls link one for me,0.188
canon 200d vs canon 70d which one should i buy .....your advice .............,0.0
If i have to choose between Nikon D5600 and Canon 200D.. which one is best? I will be using it for vlogging.,0.6369
Watching this to get me more hyped as im getting one tommorow,0.0
"Thank you so much, I have been looking at the sl2 for a little while and wasn’t quite sure until this video, it has every thing I need thanks😃",0.624
Can u do a G7X and SL2 comparison? Can't decide.... I love the portability of G7X since I think I'll be carrying it around for traveling and stuff but like u said would love to b able to try out different lenses as a beginner for photography as well. So I wna see how much better the quality is to see if it is worth carrying all tht extra weight haha. Thank you!,0.917
i am gonna buy this tomorrow !!,0.0
"I got this camera a fee days ago to start vlogging... Probably the best camera for the money I have ever seen!  Amazing quality, easy to handle for vlogs! Honestly I take it everywhere now :) hope that helps some people.",0.9719
"im getting this, my phone sucks need to upgrade for my youtube channel",-0.3612
"Pushup game, weak",-0.4404
"YOOoooooo, no way, you live in the area where I used to live!",-0.3595
So you aren't helping me get further faster? 🙁,-0.285
Videomic does not Work no the camera año boda knows why?,0.2235
"That is one very encouraging rectangle. ""I like it. What is it?"" Great review!",0.8906
Great video I just bought the Canon SL2 & is a great easy dslr camera for a beginner like me is brilliant thanks peace,0.9744
I've had my mind set on the Panasonic G7 for some time now. Now I saw this video and I'm swaying in my choice. Any advice on the 2? 4k is great but isn't a deal breaker for me.,0.3716
what mic are you using?,0.0
I am a musician who is look to use a DSLR for recoding my self playing and live streaming. I don't want to spend a ton of money for something that I am just going to put on a stand and hit record or sync up to YouTube.,0.1476
I'm thinking of buying my first camera to make videos and photos. between sl2 and t7i which you recommend me.,0.3612
"This channel is dangerous for someone like me, who is looking to step up their YouTube channel by investing in a new camera, because there are so many videos to watch! My mind has changed from wanting the G7x Mark ii, to the Sony a6000, to the Lumix G7, to now the SL2 thanks to this video. My final decision, as of now, is the SL2, but if anyone has experience and opinions with any of the cameras that I listed, please let me know before I splurge on the SL2 :)",0.8356
i have heard so many different videos confused at what to get so not been able to get any! lol   just trying to find the best for under 500 with a view flip screen I need to see what i am doing.  but i can add light and micro too... and not blurry if i move it around.  Mostly be using inside on projects.,0.5553
Does this shoot 120fps,-0.34
"I think I’m buying this, looks like a great option",0.765
Can the sl2 be connected to a tv monitor for a view finder with a hdmi cord?,0.0
What would u recommend the t3i or sL2 for a beginner youtuber??,0.4329
Thats what i need,0.0
Is the SL2 the same as the T6 1300D 18MP with EF-S ??  Every time i look up the Canon T6....The SL2 comes up???,0.0
"EXCELLENT Video.. THANK YOU!!! I am new to DSLR world of Photography. I am looking to capture dancers, runners and landscapes (sunsets ) This seems like a good pick.. Did I miss how many FPS for still shots? THANK YOU :)",0.9616
"Hi Sean! Great video! I'm looking for a new camera to improve my YouTube channel and was considering the G7X but after watching this video I think it would be more beneficial to get the SL2. I'm not a ""techy"" person but I'm learning so much from you channel because you explain things so well! I subscribed too :)",0.9537
"Sounds like a pretty good camera. One thing it will lack as a DSLR is the capability of being used for streaming via a capture card. Also you kinda always make it sound like mirror-less is worse than DSLR. This is absolutely not the case. In my case, I'm looking at the Sony a5100 as a second camera for video and streaming as it has a clean image setting for HDMI out. Granted, I'm already invested in the Sony ecosystem, but DSLR cannot be used for streaming because of the mirror that won't stay up for a few hours.

But as I said it seems like a pretty good camera and one clever thing about stating out with it is, you can actually adapbt cannon(or any SLR) lenses to mirrorless, so if you chose to go for a mirror-less later, you will at least have your old canon glass to use to begin with :o)",0.977
"You deserve a Like, Comment and Subscribe 👌",0.3612
Best Christmas Gift! Nice Content!💓 Great for vlogging,0.9391
I think it too good,0.4404
To expensive for me💔💔💔,0.0
What are some good lenses for recording video?,0.4404
nice,0.4215
super helpful!!🙌🏻🙌🏻,0.6688
I am SOLD on the sl2 ... but what lens should I get - if any? For making beauty videos,0.7351
"I think I've found my first dslr camera! I saw this in store at a local BestBuy and was amazed how petite it was while still having a nice deep dslr handle grip and feel. The store dealers obviously wanted to persuade me to go up the line to the T7i and even the EOS 70D (because sell higher = meeting quota quicker), but even still I was very magnetized to the SL2 and felt it would be perfect for where I am in photography. As mentioned in this video, it has the dslr fitment which means I can invest into dslr lenses (which is the important long term factor anyways) and because it is so small, when I decide to get into street photography, this will be much less intimidating than say a Nikon D750 or worse, a Canon 1D lol.",0.7705
"Hi, Thanks for making this video. I want to know if we can do Astrophotography with this camera (SL2/200D)?",0.4939
"Sounds great! I want this camera, it sounds amazing and so useful!",0.9182
"Explained good
Thanku",0.4404
"Hi guys!
Can anyone tell me if I can use the touch screen to take picture as well and not only for video?
Thanks!!",0.7074
I'd love to afford the sl2,0.6369
I'm so thankful for your channel cuz I wouldn't know anything about these things cuz you make it interesting to watch plus your super thorough and I'm impressed and very thankful for all your hard work. It's fed worth it!,0.9611
Awesome video! Definitely helped me make a decision on what camera to get.,0.7959
this camera provides great features in this price range.,0.6249
I still think that the sony a6000 is better. Although sony lenses are expensive. Dual Pixel AF is the best!,0.8122
I like this camera! But the focus points is a deal breaker for me,0.4199
I think this is the third time I have watched this. I wanted this camera. I watched about 70D and thought that was better... replayed with and now this is best for me. Just wanting it to go back on sale,0.6369
"Great. Now please research the meaning of the word “budget”. $600 dollars is not budget, and is actually expensive.",0.7506
"Hey sean I shared your giveaway to all my Facebook,Twitter,instagram,and other ways for entries really enjoy your video thank you",0.8122
Does this camera have image stabilization for video recording?,0.0
Hey. Does it have image stabilizer,0.0
So 200 has best auto focus,0.6666
Whered you get that mic at?,0.0
"Hello, I'm just wondering what is the maximum time you can shoot video for on this camera.  Assuming a 128GB card, and recording at 1080p/60fps.  I can't seem to find that information anywhere on the Internet.",-0.34
чувак упоротый в дымину,0.0
Very nice advices 😊,0.4754
What do you think about the cannon power shot ax 60 hs?,0.0
I got this because I had all my canon lenses already. And actually thought of getting the 77D but when I compared the only difference was focus points a more stills per second. Easiest $200 saving that will go toward a new camera when canon finally wake up to 4K at which point this will become b roll. The mic input in front of the flip out screen is a bit inconvenient. But I can live with it. Also nice is the battery door opens when mounted on a tripod plate.,0.6486
You nailed it.,0.0
"I was looking for a DSLR, my budget is about 600 dollars. Mostly I do random videos inside, but once at a while I do vlogs or challenges.
Is the SL2 ideal or would you recommend something else?",0.8519
Thumbs for Sgt. Pepper.,0.0
Subscribed and turned on notifications.  Impressive channel Sean. WEALTH of info!,0.8188
Thanks for Very much your Canon SL2 Review. It's time for me to change my OLD OLD Canon Digital Camera IXUS using all the time for YouTubube Video.,0.4404
What do you think about the Nikon D5600 vs the SL2?,0.0
whats the cheapest lense that can zoom in the farthest for this camera?,0.0
By sean I just bought a canon sl2 please make a video on how to use the camera and the best set up for YouTube video cause I think a lot of poeple are going to buy this camera,0.7579
Does this camera do good with live streaming video?,0.4404
"i wondered , does this amazon link sell the 18-55mm kit lens but with image stabilization?",0.1122
"11:00
Can someone tell me why 9 auto focus points doesn't affect to the video quality? I was confused what to buy between 77d and SL2, and I'll definitely buy SL2 thanks to Sean, but still I want to know why auto focus points affects on the photo quality not the video quality :D",0.8462
"Hey Sean! Do you feel this Canon SL1  is a better vlogging camera than the Panasonic G7? If So, why?",0.5502
Which is better this or a t6?,0.4404
Hey Sean! Can you tell me how long can it take uninterrupted recording? Can it be used to record talks or presentations?,0.0
"Hi, great video! I'm thinking to buy this camera, the only thing I would like to make sure is if with this camera is possible to create the background blury effect...",0.8832
This camera can be compared to the Nikon D3400,0.0
which lense should i upgrade to with this camera  i am a tech youtuber,0.0
Hi Sean~ thank you for this! Is this good also for close ups say accurate color and close ups on makeup tutorials?,0.7325
This was extremely informative! I️ appreciate your knowledge of this camera! Bought one today! So excited to work with it!,0.7798
"subscribe to my channel guys
i subscribe you too 
thanks you :)",0.7096
Hello. İ have questions.  Nikon D3400 & Canon SL2. Which one is good for photo (not vlogging)? Which one take a picture very sharpness and very beautiful?,0.8153
Is it better than eos 750d for photographing ?,0.4404
"Excellent review, it has helped me decide to buy this.  Cheers!",0.8233
"DUDE!  LISTEN.  AT THIS POINT IN THE TECH ADVANCEMENT GAME, THE BATTLE WHICH THE ORDINARY LITTLE GUY IS FIGHTING IS TO FIND AN AFFORDABLE 4K CAMERA WHICH ALSO DOES 60FPS.  ANY-1 WANTING ON-ITS-WAY-OUT 1080P SHOULD GET A USED POINT&SHOT.",-0.6284
bought this camera because of your video,0.0
This is the video review i wanted to see. Thank your for posting it😃,0.3612
it is very good but one most Problem .it has just 9 focus point.,-0.4391
it is very good but one most Problem .it has just 9 focus point.,-0.4391
Did anybody else have to keep looking stuff up on google because they didn't understand the camera gibberish he was saying......no just me? Ok.,0.296
"Very informative videos, I am wondering why size matters in a camera, they don't vary in size much, why is smaller better? Or is it? I am thinking of buying the T6i after the new year, it seems very comparable to the SL2, but it's a little larger.",0.3313
Seems im going to buy this crazy deal with tons of features! This model doesn't need any promo. It sells itself! Tons of features with expandable possibilities! 💯,-0.5612
Thank you so much for what you do. Your really helping me out. I'm just starting up my page and I'm learning a lot from you,0.6115
Great presentation,0.6249
If you had to compare it with the LumixG85 and this one which one would you choose for a vlogging camera? I'm torn between them,-0.25
How long is recording time? Would you recommend this for beginner journalist? I'm doing interviews for class and a roll and b roll footage.,0.4329
I just bought my first dslr/sl2 camera today and I'm so exctited to use it! I've been subscribed to you for over a week now and thank you so much for helping us by making so great contents!! Please continue guide us well! Have a nice day and greetings from Norway^^ Martin.,0.9667
"hi sean, I really need your help I can seem to be able to connect my mic ( the same one in your video) to my camera ( SL2) can you please help me?",0.8035
STILL NOT CHEEP ...I WANT SOMETHING JUST OVER A CELL PHONE THAT DOES COST AN EAR AND LEG !!!......,-0.39
Hey just wondering do u really wear that headband out and about? Or was that just a joke?,0.3736
"Im starting a show where there will be multiple host, would this be a good starter camera for that?",0.4404
Awesome video Sean :) I'm definitely considering purchasing the Canon Rebel SL2 based largely on your video and other review videos I've watched. Quick question if you've ever done it yourself is it possible to connect and operate an XLR microphone into the camera using an XLR to 3.5mm jack adapter?.,0.8481
Great video! Buying SL2 as soon as I get my next salary lol,0.8016
"Do you recommend buying this camera with the kit for $699 on amazon or buying the camera with the kit plus some other stuff like a bag, filters and memory cards for $699 on amazon??",0.7757
Does it do 4k?,0.0
"Uhg idk I what to buy I own the g7 rn, was looking at getting the canon 70d, but idk if I should get this one please help!🙏🏻",0.3489
Would you still recommend this camera. Even if I️ want to do sports photography,0.4215
"What camera should I get for my first camera for video and photography?!? (Canon t5i, Canon SL2, or Canon t6s)",0.0
I'd love to see you do a sl2 versus iphone 8 comparison.,0.6369
How good is a canon powershot sx60 powershot compared to this?,0.4404
Just saying that the mic he was using was the rode videomicro,0.0
I paid the SL2 400€,0.0
Is this camera available in the UK or known as a different model in the UK as i cannot find it.,0.0
Hey Sean! You mentioned the aftermarket batteries for the SL2 but I can't seem to find them. I am ordering from Canada. Can you let me know which are the best please? Thank you!,0.9272
I have a Canon Rebel T6i. Is it worth selling and upgrading to the SL2?,0.0772
HEY! Do you know if you can hook up the SL2 to an external monitor for a LIVE view of what you're shooting?,0.0
"Just ordered from B & H on a price match for $499 delivered. Amazing value vs 7ti, 77D and 80D. $150-$500 savings.",0.7351
"Now you got me thinking about adding to go with my current Canon DSLR,  I already use a Sony a6000 as my second camera, its an awesome camera it has wifi and a crazy AF system but being able to use Canon lenses  hmmmm. 
My main use  for it  would be to take photos for online clients and social media since it has wifi which my main DSLR does not have.",0.2144
Hi Sean which one would you go for out of the SL2 or 70 d as prices are simliar in the ukand i have a lot of pro u tube videos i need to do? Many thanks Sean Harris,0.4404
Does it over heat,0.0
You Videos Are Helping Me So Much With Starting With YouTube Channel,0.296
How do you get your videos so smooth fo you use a gimbal?,0.0
"i juz decide to buy 800d , and yet i saw this video adn i change my mind.... going to get a sl2",0.0
"700d or 200d or 800d???
which is the best? please reply going to buy my first dslr camera.
does these have image stbilization",0.8156
Is 200d is good for bird PHOTOGRAPHY ? I am interesting in Birds,0.6808
"Thank you for the video. For pics, do you recommend this sl2 or the t6i? Thank you",0.7579
Just bought the sl2 can't wait till it arrives,0.0
Very helpful! Thank you!,0.7547
How much is it,0.0
"I know you said the other version of this camera would be better for photograph pictures,  but will I still be able to the semi good pro pictures with this camera.",0.7003
*Great Review!*   Looks like I'll be updating my YouTube Channel with this new camera.  Buying today!  I've been researching for a while now and I think this is exactly what I'm looking for.,0.4738
hey sean which is better canon sl2 or canont7i,0.4404
Is that area in San Diego over by Black Mountain?,0.0
I heard somewhere that SL2 doesn't perform well in Low light in video recording as compared to other Canon cameras. Is that true?,-0.0294
Is it better than 750d for photography? please suggest.,0.6369
"But can it it on standard tripods? I want to get a tripod with a cross bar for the ""food angle"" above the table.Does this work with any of the tripods or is there a particular size?",0.168
"Don't know about cameras but i want one with:
       live preview screen,
       shoots full frame,
       and has someplace to install an external flash
Does this camera have this?",0.1154
great review,0.6249
this is a great video so well explained and this is my next camera. also liked how you broke down you don't have to spend alot to get a great camera with great features.,0.9402
Hey what do you think is a good camera for recording video for tech reviews on YouTube and want good photos too. Something that can use am external mic and is between 600-800,0.7269
"Sl2 or T6i for a all around mix of videography, photography, and occasionally vlogging (mainly Traveling) what’s your opinion?",0.0
"I just bought this camera based on your review, thanks Sean!!",0.5399
I purchased the camera before watching your video and it looks like I made a good choice! I was able to purchase a bundle pack that has extra lens! I cannot wait until I actually have it in my hand!!,0.8679
"which one is better 
canon 200d or 750d",0.4404
Hey Sean!  Thank you for the awesome video on the Canon 200D.. I am a looking to getting this camera for my new YouTube Channel. I had a question on this camera. Is it a good camera for live streaming. Is this camera even capable for that?,0.908
What is the best all round camera for out doors and vlogging at a cheap price?,0.6369
"hey sean! Is canon sl2 a good option for PICTURE BLOGS?
Is sl2 capable of good photography?",0.8423
Hey all. I have a D3400 and I’m thinking of upgrading. Any suggestions? I don’t necessarily want to stay with a Nikon and I was actually thinking of the Sony A6300. Any suggestions or ideas?,0.168
"Great video Sean. I bought this camera. I just need your help deciding on a lens for videos. I've already watched your other video about lenses, where you were recommending the 24mm as the YouTube lens, but in almost all your videos, in the description it says you're using the 10-18 mm one. So I'm not sure which one to go for?  Would the 24mm one work with the Ring Light, considering the ring light needs to be close to you, but the 24mm lens it's more ""zoomed"" in than the 10-18mm one, in order to achieve a similar shoot like yours, capturing half way up of the body? Or do I need the 10-18 one? P:s I'm not really interested in the wide angle.",-0.4662
I have this camera and made a travel video with it to New York City earlier this year. Everything was shot with this camera. I love it!,0.6696
This camera or the Canon T7I???,0.0
"Hi! Very cool review. But two questions:
1. It's good for filmmaking? I want to make no youtube-video, I mean art short movies (or no short) ets for any festivals. And do manual focus, take audio not from camera. Just I don't see better choice than that Canon. Or maybe Sony a5100. 'Cause no budget, and I need advice from smart man (alvo from smart subscribers).
2. Can I put in picture profiles like c-log in that Canon?
Thanks!",0.9007
"Amateur photographer here.

I just moved from a SLR (Olympus OM2 - yeah) to DSLR. I bought the SL2/200D and couldn't be happier about it. I see people complaining about having only 9 AF points. Well, that's lazy... I had none and that has never been an issue for me! Wanna track high speed objects? Use the center one and keep you subject on focus! 

I'm very happy with the overall result. I've been able to shoot fantastic pictures with it and I highly recommend it for beginners, prosumers or even professionals as a backup camera (because it's light yet fully capable).",0.796
"What's the maximum video length you can records on the SL2? Also.. If i was to buy a new camera today, would you recommend 70D as I saw on your other older videos, or the SL2?",0.4329
which one is better for photography in Nikon D5300 and Canon EOS 200D,0.4404
Does anyone know if the HDMI output is true 1080p? Other cheaper canon DSLR didn't used to output true 1080p via HDMI out.,0.6808
"Cheers for such professional video. Would you recommend this over the Panasonic G7? given that both are almost the same price, but G7 has 4k, while the 200D has the Dual Pixel AF. My main uses of the camera are makeup tutorial videos on tripod, and makeup before/after still photos (not studio setup, so sometimes low light..etc). I started by looking at the 200D, then went up to the 800D, then to the Panasonic G7, then now back to the 200D, so confusing. I appreciate your input. thanks in Advance.",0.65
"Hey Sean! I'm having a really hard time deciding between a couple of cameras. I'm starting a YouTube page devoted mainly to toy hunting and vlogging. So low light, image stability, and auto focus is all important. I've been looking at a few different cameras: the Sony a5100, Canon g7x Mark ii, Panasonic g7, and the Canon sl2. I would really appreciate your input. Thanks!",0.784
Thank you for your great videos. You are awesome. Can you recommend a very good lens and light set for this camera? Thank you.,0.9577
How would u recommend this over Canon EOS M6?,0.3612
What are the best lenses for this camera??,0.6767
Hey Sean! :D I need a wide lense for YouTube. I currently have sony a6300 with few lenses and I'm wondering if it's better for me to buy sony 10-18 lense or for the same price canon SL2 + canon 10-18 lense. Can You give me your opinion?,0.8034
The SL1 was my favorite and I'm happy to see they released an even better model of it.,0.8625
i wish this went up to 120 fps.. i'm debating about getting this as my main but also sony rx100 v for travel and that slow-mo 4k quality,0.2144
"You didn't give us the cons.
Like the fact the mic cable gets in the front of the screen...
It's suspicious since you had the external mic connected but never did you show us that problem which you knew about!
The idea I got was you were trying to sell us the camera, and you get a comission for it. 
I was expecting a more honest review, Sean.
I'm not saying the camera isn't good.
I have no idea.
I'm saying your video wasn't what it should be.",0.2154
